{
  "event_count": 29,
  "events": [
    {
      "confidence": "high",
      "event_date": "2026-07-12",
      "event_kind": "quota_change",
      "id": "2026-07-12-openai-chatgpt-weekly-window-agentic-credits",
      "matched_refs": [
        "provider:openai"
      ],
      "provider_refs": [
        "provider:openai"
      ],
      "severity": "high",
      "summary": "OpenAI restructured ChatGPT and Codex usage limits so a weekly limit governs the primary cap, reported suspending the shared five-hour window on Plus, Pro, and Business plans, while adding purchasable ChatGPT credits to continue past included usage and banked rate-limit resets earned through referrals.",
      "title": "OpenAI Made Weekly Limits Primary For ChatGPT Codex Usage And Added Purchasable Credits"
    },
    {
      "confidence": "confirmed",
      "event_date": "2026-07-09",
      "event_kind": "workflow_behavior_change",
      "id": "2026-07-09-openai-chatgpt-codex-app-unification",
      "matched_refs": [
        "app:codex",
        "provider:openai"
      ],
      "provider_refs": [
        "provider:openai"
      ],
      "severity": "high",
      "summary": "OpenAI folded the standalone Codex desktop app into a single ChatGPT app with Chat, Work, and Codex modes, made ChatGPT Work share Codex usage limits, pricing, and credits, launched the GPT-5.6 Sol, Terra, and Luna model family, and moved Codex developer docs from developers.openai.com/codex to learn.chatgpt.com/docs.",
      "title": "OpenAI Unified The Codex App Into ChatGPT With Chat, Work, And Codex Modes"
    },
    {
      "confidence": "confirmed",
      "event_date": "2026-06-16",
      "event_kind": "regional_availability_change",
      "id": "2026-06-16-openai-codex-eea-computer-use-chrome-memories",
      "matched_refs": [
        "app:codex",
        "provider:openai"
      ],
      "provider_refs": [
        "provider:openai"
      ],
      "severity": "medium",
      "summary": "OpenAI Codex changelog says more Codex app capabilities are rolling out in the European Economic Area, United Kingdom, and Switzerland, including Computer Use, the Chrome extension, Memories behavior, and Chronicle preview availability for Pro users on macOS.",
      "title": "OpenAI Expanded Codex Computer Use, Chrome Extension, Memories, And Chronicle In Europe"
    },
    {
      "confidence": "confirmed",
      "event_date": "2026-06-15",
      "event_kind": "workflow_behavior_change",
      "id": "2026-06-15-openai-codex-ios-cli-mcp-bedrock-workflows",
      "matched_refs": [
        "app:codex",
        "provider:openai"
      ],
      "provider_refs": [
        "provider:openai"
      ],
      "severity": "high",
      "summary": "OpenAI Codex changelog records June 15 updates for ChatGPT iOS and Codex CLI, including mobile workspace browsing and diff controls, MCP approval choices, CLI usage views, permanent session deletion, Claude Code import, managed Amazon Bedrock API-key authentication, and credential storage improvements.",
      "title": "OpenAI Codex Added Mobile Workspace Controls, MCP Approvals, Usage Views, And Bedrock Auth"
    },
    {
      "confidence": "confirmed",
      "event_date": "2026-06-11",
      "event_kind": "rate_limit_change",
      "id": "2026-06-11-openai-codex-app-rate-limit-reset-computer-use",
      "matched_refs": [
        "app:codex",
        "provider:openai"
      ],
      "provider_refs": [
        "provider:openai"
      ],
      "severity": "high",
      "summary": "OpenAI's Codex app 26.609 changelog records rate-limit reset banking for Plus and Pro users, shared Business workspace credit referrals, Developer mode browser debugging, and expanded Computer Use controls and availability.",
      "title": "OpenAI Codex App Added Rate-Limit Reset Banking And Computer Use Controls"
    },
    {
      "confidence": "confirmed",
      "event_date": "2026-06-09",
      "event_kind": "workflow_behavior_change",
      "id": "2026-06-09-openai-codex-mobile-worktrees-goals-review",
      "matched_refs": [
        "app:codex",
        "provider:openai"
      ],
      "provider_refs": [
        "provider:openai"
      ],
      "severity": "medium",
      "summary": "OpenAI's Codex changelog for ChatGPT iOS 1.2026.153 records Codex Mobile support for branch/worktree setup, environment setup scripts, goal management, inline review comments, side chat from transcript selection, prompt editing, and usage/token activity views.",
      "title": "OpenAI Added Codex Mobile Worktree, Goal, And Review Controls"
    },
    {
      "confidence": "confirmed",
      "event_date": "2026-06-09",
      "event_kind": "workflow_behavior_change",
      "id": "2026-06-09-openai-codex-cli-web-search-schema-marketplace",
      "matched_refs": [
        "app:codex",
        "provider:openai"
      ],
      "provider_refs": [
        "provider:openai"
      ],
      "severity": "medium",
      "summary": "OpenAI's Codex CLI 0.139 changelog records standalone web search support in code mode, richer tool/connector schema preservation, expanded local diagnostics, plugin marketplace JSON/source metadata, and fixes for resume/fork prompts, MCP startup warnings, image edits, and URL handling.",
      "title": "OpenAI Codex CLI Added Web Search, Schema, And Plugin Marketplace Updates"
    },
    {
      "confidence": "confirmed",
      "event_date": "2026-06-09",
      "event_kind": "workflow_behavior_change",
      "id": "2026-06-09-openai-codex-app-migration-plugins-settings",
      "matched_refs": [
        "app:codex",
        "provider:openai"
      ],
      "provider_refs": [
        "provider:openai"
      ],
      "severity": "medium",
      "summary": "OpenAI's Codex changelog for app version 26.608 records new migration flows from Claude Code and Claude Cowork setup, a revamped plugin management screen, broader settings search, and several workflow reliability fixes.",
      "title": "OpenAI Codex App Added Migration, Plugin, And Settings Improvements"
    },
    {
      "confidence": "confirmed",
      "event_date": "2026-06-08",
      "event_kind": "api_contract_change",
      "id": "2026-06-08-openai-codex-cli-app-handoff-pat-plugin-json",
      "matched_refs": [
        "app:codex",
        "provider:openai"
      ],
      "provider_refs": [
        "provider:openai"
      ],
      "severity": "high",
      "summary": "OpenAI's Codex CLI 0.138 changelog records CLI-to-desktop app handoff, saved image file-path exposure, model-defined reasoning effort ordering, account token usage reads for app-server integrations, v2 personal access token support, and richer structured plugin command output.",
      "title": "OpenAI Codex CLI Added App Handoff, PAT, And Plugin JSON Contracts"
    },
    {
      "confidence": "confirmed",
      "event_date": "2026-06-04",
      "event_kind": "workflow_behavior_change",
      "id": "2026-06-04-openai-codex-cli-admin-rpc-tools-agents",
      "matched_refs": [
        "app:codex",
        "provider:openai"
      ],
      "provider_refs": [
        "provider:openai"
      ],
      "severity": "high",
      "summary": "OpenAI's Codex CLI 0.137 changelog records expanded terminal controls, monthly credit-limit and cloud-managed config support for enterprise/admin flows, app-server v2 controller grant RPCs, plugin JSON/catalog improvements, hosted web and image tools in more code-mode flows, multi-agent v2 runtime metadata, and multiple reliability fixes.",
      "title": "OpenAI Codex CLI Added Admin Config, Controller RPCs, Hosted Tools, And Multi-Agent Updates"
    },
    {
      "confidence": "confirmed",
      "event_date": "2026-06-04",
      "event_kind": "workflow_behavior_change",
      "id": "2026-06-04-openai-codex-app-computer-use-plugin-config",
      "matched_refs": [
        "app:codex",
        "provider:openai"
      ],
      "provider_refs": [
        "provider:openai"
      ],
      "severity": "medium",
      "summary": "OpenAI's Codex app 26.602 changelog records profile activity insights/share cards, Computer Use startup readiness and appshot error-reporting improvements, browser/review UI fixes, expanded onboarding role choices, and a fix for configuration writes after plugin installation.",
      "title": "OpenAI Codex App Improved Computer Use Startup And Plugin Config Writes"
    },
    {
      "confidence": "confirmed",
      "event_date": "2026-06-04",
      "event_kind": "api_contract_change",
      "id": "2026-06-04-openai-moderation-scores-api",
      "matched_refs": [
        "provider:openai"
      ],
      "provider_refs": [
        "provider:openai"
      ],
      "severity": "medium",
      "summary": "OpenAI added moderation-score output support to Responses API and Chat Completions generation requests, letting callers request moderation results for both input and generated output in the same response path.",
      "title": "OpenAI Added Moderation Scores To Generation API Responses"
    },
    {
      "confidence": "confirmed",
      "event_date": "2026-06-04",
      "event_kind": "status_incident",
      "id": "2026-06-04-openai-image-api-401-errors",
      "matched_refs": [
        "provider:openai"
      ],
      "provider_refs": [
        "provider:openai"
      ],
      "severity": "medium",
      "summary": "OpenAI status recorded a resolved degraded-performance incident where Image API requests returned 401 errors, affecting API users during the incident window.",
      "title": "OpenAI Image API Requests Returned 401 Errors"
    },
    {
      "confidence": "confirmed",
      "event_date": "2026-06-04",
      "event_kind": "status_incident",
      "id": "2026-06-04-openai-codex-compaction-latency",
      "matched_refs": [
        "app:codex",
        "provider:openai"
      ],
      "provider_refs": [
        "provider:openai"
      ],
      "severity": "low",